<?xml version="1.0" encoding="UTF-8"?>
<!DOCTYPE products SYSTEM "products.dtd">
<products>
    <info>
        <company>TechStart Digital Solutions</company>
        <lastUpdated>2024-01-15</lastUpdated>
        <version>1.0.0</version>
        <description>Complete product catalog for TechStart Digital Ecosystem</description>
    </info>
    
    <categories>
        <category id="web">
            <name>Web Development</name>
            <description>Complete web development solutions and services</description>
            <icon>fas fa-code</icon>
        </category>
        <category id="mobile">
            <name>Mobile Applications</name>
            <description>Cross-platform mobile app development</description>
            <icon>fas fa-mobile-alt</icon>
        </category>
        <category id="api">
            <name>API Services</name>
            <description>RESTful APIs and system integrations</description>
            <icon>fas fa-plug</icon>
        </category>
    </categories>
    
    <products>
        <product id="1">
            <name>Web Development Package</name>
            <description>Complete web development solution with modern frameworks including React, Node.js, and MongoDB</description>
            <category>web</category>
            <tagprice currency="USD">2999.00</tagprice>
            <image>fas fa-code</image>
            <tags>
                <tag>HTML</tag>
                <tag>CSS</tag>
                <tag>JavaScript</tag>
                <tag>React</tag>
                <tag>Node.js</tag>
            </tags>
            <features>
                <feature>Responsive Design</feature>
                <feature>SEO Optimization</feature>
                <feature>Database Integration</feature>
                <feature>User Authentication</feature>
                <feature>Payment Processing</feature>
            </features>
            <availability>In Stock</availability>
            <rating>4.8</rating>
            <reviews>127</reviews>
        </product>
        
        <product id="2">
            <name>Mobile App Development</name>
            <description>Cross-platform mobile app development using React Native for iOS and Android</description>
            <category>mobile</category>
            <tagprice currency="USD">3499.00</tagprice>
            <image>fas fa-mobile-alt</image>
            <tags>
                <tag>React Native</tag>
                <tag>iOS</tag>
                <tag>Android</tag>
                <tag>Cross-platform</tag>
                <tag>App Store</tag>
            </tags>
            <features>
                <feature>iOS & Android Support</feature>
                <feature>Native Performance</feature>
                <feature>Push Notifications</feature>
                <feature>Offline Capability</feature>
                <feature>App Store Deployment</feature>
            </features>
            <availability>In Stock</availability>
            <rating>4.9</rating>
            <reviews>89</reviews>
        </product>
        
        <product id="3">
            <name>API Integration Service</name>
            <description>RESTful API development and third-party integrations for seamless data flow</description>
            <category>api</category>
            <tagprice currency="USD">1999.00</tagprice>
            <image>fas fa-plug</image>
            <tags>
                <tag>REST API</tag>
                <tag>Node.js</tag>
                <tag>Express</tag>
                <tag>MongoDB</tag>
                <tag>Authentication</tag>
            </tags>
            <features>
                <feature>RESTful Architecture</feature>
                <feature>JWT Authentication</feature>
                <feature>Rate Limiting</feature>
                <feature>API Documentation</feature>
                <feature>Third-party Integrations</feature>
            </features>
            <availability>In Stock</availability>
            <rating>4.7</rating>
            <reviews>156</reviews>
        </product>
        
        <product id="4">
            <name>E-commerce Solution</name>
            <description>Complete e-commerce platform with payment integration and inventory management</description>
            <category>web</category>
            <tagprice currency="USD">4999.00</tagprice>
            <image>fas fa-shopping-cart</image>
            <tags>
                <tag>E-commerce</tag>
                <tag>Payment</tag>
                <tag>Inventory</tag>
                <tag>Analytics</tag>
                <tag>CMS</tag>
            </tags>
            <features>
                <feature>Product Management</feature>
                <feature>Payment Gateway Integration</feature>
                <feature>Order Processing</feature>
                <feature>Inventory Tracking</feature>
                <feature>Analytics Dashboard</feature>
            </features>
            <availability>In Stock</availability>
            <rating>4.9</rating>
            <reviews>203</reviews>
        </product>
        
        <product id="5">
            <name>Cloud Migration Service</name>
            <description>Migrate your applications to cloud platforms with zero downtime</description>
            <category>api</category>
            <tagprice currency="USD">2499.00</tagprice>
            <image>fas fa-cloud</image>
            <tags>
                <tag>AWS</tag>
                <tag>Azure</tag>
                <tag>Google Cloud</tag>
                <tag>DevOps</tag>
                <tag>Migration</tag>
            </tags>
            <features>
                <feature>Zero Downtime Migration</feature>
                <feature>Cloud Architecture Design</feature>
                <feature>Security Implementation</feature>
                <feature>Performance Optimization</feature>
                <feature>24/7 Support</feature>
            </features>
            <availability>In Stock</availability>
            <rating>4.6</rating>
            <reviews>78</reviews>
        </product>
        
        <product id="6">
            <name>UI/UX Design Package</name>
            <description>Modern user interface and experience design with prototyping</description>
            <category>web</category>
            <tagprice currency="USD">1799.00</tagprice>
            <image>fas fa-paint-brush</image>
            <tags>
                <tag>Figma</tag>
                <tag>Adobe XD</tag>
                <tag>Prototyping</tag>
                <tag>User Research</tag>
                <tag>Design System</tag>
            </tags>
            <features>
                <feature>User Research</feature>
                <feature>Wireframing</feature>
                <feature>Prototyping</feature>
                <feature>Design System</feature>
                <feature>Usability Testing</feature>
            </features>
            <availability>In Stock</availability>
            <rating>4.8</rating>
            <reviews>94</reviews>
        </product>
        
        <product id="7">
            <name>Progressive Web App</name>
            <description>Modern PWA with offline capabilities and app-like experience</description>
            <category>web</category>
            <tagprice currency="USD">2299.00</tagprice>
            <image>fas fa-globe</image>
            <tags>
                <tag>PWA</tag>
                <tag>Service Workers</tag>
                <tag>Offline</tag>
                <tag>Push Notifications</tag>
                <tag>Responsive</tag>
            </tags>
            <features>
                <feature>Offline Functionality</feature>
                <feature>Push Notifications</feature>
                <feature>App-like Experience</feature>
                <feature>Cross-platform</feature>
                <feature>Fast Loading</feature>
            </features>
            <availability>In Stock</availability>
            <rating>4.7</rating>
            <reviews>112</reviews>
        </product>
        
        <product id="8">
            <name>AI Integration Service</name>
            <description>Integrate artificial intelligence and machine learning capabilities</description>
            <category>api</category>
            <tagprice currency="USD">3999.00</tagprice>
            <image>fas fa-brain</image>
            <tags>
                <tag>AI</tag>
                <tag>Machine Learning</tag>
                <tag>Python</tag>
                <tag>TensorFlow</tag>
                <tag>API</tag>
            </tags>
            <features>
                <feature>Machine Learning Models</feature>
                <feature>Natural Language Processing</feature>
                <feature>Image Recognition</feature>
                <feature>Predictive Analytics</feature>
                <feature>Custom AI Solutions</feature>
            </features>
            <availability>In Stock</availability>
            <rating>4.9</rating>
            <reviews>67</reviews>
        </product>
    </products>
</products>
